article_id,question,correct_answer,false_answer
63875,Why did Moynihan shoot Stanley?,Stanley tried to poison him.,Stanley was protecting Albert Peet.
63916,"Of the following options, which best summarizes this story?",A man enters a club on Venus to research and participate in a strange form of entertainment.,A man enters a club on Venus to discuss business with a few colleagues.
24977,Why it was Spencer shot by the police at the bar?,He refused to tell the policeman what was wrong with him.,"There was no reason, it was a random act of violence."
50969,What is NOT true of the crew?,They could all mate with each other (it was explicitly discussed as a possibility in the story),They are all different species
55933,Why was Socks a part of this story?,"Technically Socks helped Peggy pass the time, but Socks also gives us more of an idea of what Peggy's life at home is like and how wonderful it is.",She only helped Peggy pass time while her parents made a decision.
61090,"Why does The Scorpion go mostly unnoticed, despite reaching out to the newspaper? ","Their first letter was disregarded, and their second was read by a different person. ","The police don't want to bring attention to them, because they don't believe there is a connection between the crimes. "
61081,What did Orison do when she met Kraft Gerding?,She snapped at him and threatened to quit.,She went to visit him on the upstairs floors.
27588,What incorrect assumption does Trella make about Blessing? ,He would be thrilled to hear that Quest is alive and well,He has no prior knowledge of the contents of Mansard's documents
51129,what is the 'gift from Earth'?,capitalism,destruction of the caste system
20077,How does Leigh likely feel about Gilbert and Sullivan?,Great respect,Neutral
50969,What is NOT a technological advancement involved in this story?,Advanced weaponry,Rapid healing abilities
20028,Which isn't true of the test results?,Hefeweizens were not popular among the testers,American beers typically scored higher
61242,Why did Major Winship likely refuse to call for help when they could not communicate with Pinov?,He was stubborn.,He wanted to handle the situation by protocol. 
20012,What seems to be Krugman's biggest issue with Arthur?,Arthur received too much credit for increasing returns.,Arthur didn't do enough research on increasing returns.
20038,What isn't a place that the information came from?,news shows,news columnists
53269,"How does Teena find out about radioactivity? 
","Eddie teaches Teena and her mother about about radioactivity after the news gets out about Mr. Taylor’s isotope being stolen. 
","Eddie teaches her about radioactivity when he is explaining the dream he had about Cedar Point.
"
20077,Does Morris dislike Leuchter?,"No, Leuchter is just a subject to study","Yes, Leuchter defiled Auschwitz"
20012,Why didn’t M. Mitchell Waldrop give credit to other economists in his book?,He wrote about them but it was cut during the editing process.,He left them out of the book deliberately.
61097,What is significant about the “secret” Retief unveils about the Soetti?,"They're easier to take down than they thought, meaning they can stand up to the Soetti. ",They're easy to bluff against. They'll believe what the captain tells them. 
20043,Why does the author believe Clinton is better represented than Dole?,Clinton uses proper grammar and appears sophisticated in public,Clinton is more experienced and knowledgeable than Dole
24192,Why was Hank lying down for months?,Hank's body was lying in a tank designed to regenerate his body processes.,Hank's body was lying in a cryostasis tank while the doctors figured out how to bring him back to life.
24278,Why can't they transmit Umluana as planned?,The controls at the Belderkan Preserve have been destroyed.,The controls at the Miaka station have been destroyed.
20032,What does 14 mention that no other critiques mention?,this may have a negative impact on the children,parents may be disappointed by the child born
42111,Which theory didn't they rule out for how Superior went missing?,magnetized levitation,secret government experiments
60995,Why does Linton murder Greta after just resurrecting her?,Greta attempted to kill him,He desires the rest of her insurance money
51286,What about Haron didn't excite Matilda?,his physical appearance,he lived nearby
63442,What is so unique about the cockatoos on this planet?,They are able to physically mimic any picture. ,They are able to copy speech. 
24161,What is the worst consequence of the Geiger being off scale?,Authorities will be forced to make more strict limitations when it comes to water,The entire Survey will be fired and forced to compete over prospecting jobs
23791,What do the colony inhabitants share?,fear of open spaces,traumatic brain injuries
52995,Why did the Department hope that Si would continue for three more space missions?,It would take too long to train a new pilot to complete the explorations.,He was the best of the best in the space exploration team.
24517,Who is the man climbing the mountain?,An astronomical surveyor who ended up there by accident,A mountain guide looking for survivors
20010,What was an effect of the delay in the book’s circulation?,Experts weren’t able to read through and collect evidence proving the book’s hypotheses wrong.,Criticism of the book immediately created a backlash.
62619,Why does Peter insist that Lorelei not come along for the mission?,"He knows she would mutate as well, and he wouldn't be able to handle that and put the mission at risk. ","He knows that they'll be reunited, and promises to come back."
51657,What was the one thing William admitted to doing?,stealing from the church,lying to people
51433,Why doesn't Extrone shoot the farn beasts?,Extrone wants to watch the farn beasts kill Ri.,Extrone wants to capture the farn beasts alive.
51053,Why did Opal let Rog go back to Earth?,because the aliens weren't good at capturing other men,so he could try to escape and fail
61097,Why was Retief's mission to Jorgensen's Worlds so important?,He held vital information that could change the picture of the future of the area,He was a useful aggressor who could take down an entire army if needed
50869,What is something Glmpauszn and Joe don't have in common?,their ability to become invisible,their homeland
63631,"What is the true explanation for Charles being the last man on Earth? 

","The invisible aliens exterminated people in alphabetical order, according to the the Bureau of Vital Statistics index. Charles happens to be last on the list, with the last name Zzyzst. 

","The invisible aliens exterminated people according to chance and probability. Charles just so happened to be killed last. 
"
25086,Why doesn't the robot arrive already put together?,The spaceship is only 15 feet in total circumference. If the robot was already put together it wouldn't fit inside.,The robot is sent in pieces packed in a special material to protect it from the landing impact.
52995,What is the main reason that Gubelin is so resentful of Si’s decision?,"He fears the end of the Space Exploration program, and for mankind’s research of space to come to an end.","He doesn’t want to have to go through the effort of training a new spaceman, as it’s very costly and time consuming."
31282,What is not true about the relationship between Martians and humans?,"Martians value what humans bring to their planet, including teaching them new ways to do things like conduct business and build structures.","Martians find no value in the things humans do, such as gold and diamonds, making humans feel"
50869,Why might the stories be true?,"The disappearance of Joe Binkle and Ed Smith, along with the letters and leftover clothes all point to it. ","The letters are all from different parts of the world, proving that different people wrote them. "
60283,Which is the most accurate description of why Xeon is in trouble?,The suggestions he made were against the societal ideals,He was not supposed to point out any flaws in the current government structure
61481,"Where do the creatures from another world come from? 
",Germany,"An alien world
"
51330,Why does Mrs. Graham leave such specific instructions for Mr. Graham?,Mrs. Graham strives to avoid more chaos than what Mr. Graham already attracts,"Mrs. Graham has the power to control Mr. Graham, but only in close proximity"
60897,How did the protagonist plan on beating Chapo in the card game?,By spying on him from with Japanese field glasses,By using the radio transmitter from within the same room
61467,What was Asa's true motivation for choosing Jordan's Planet?,Studying Slider eggs in their natural habitat.,He wanted to serve a reduced sentence.
24977,Why does Pembrook shoot the man in the corner?,The man in the corner is an android sent by alien masters to facilitate an invasion of Earth.,The man in the corner was an alien invader.
23588,"Which group of people shares the most similarities with the group of patients in the mental institution, as they are described by the author?",A Kindergarten class,An artists' collective
63109,Why are people after Grannie Annie? ,She knows too much about the Green Flames and they want to prevent her from obtaining it. ,"She entered the Spacemen's Club, which she was not allowed to do as a woman. "
61204,"Why doesn’t Wayne like his parents? 
","He feels that they are soft and stupid, that they’ve given up on what life has to offer.
","His parents want to keep him from breaking out, knowing that the horrors Wayne will face are too much for him. 
"
32836,What causes the shaking of the mountain?,Machines,The awakening of the Ryzgas
24966,Why is Alan so surprised to hear blaster fighting?,"Alan is surprised because the planet is only inhabited by animals, not intelligent life. ","Alan is surprised because he came with a team of scientists, not soldiers."
50969,What is NOT a similarity between Taphetta and the rest of the crew?,All of them have a comparably good reputation,All of them are respected in their fields
63097,"What is the significance of the narrator’s height? 
","It shows he is not from Dondromogon
","It shows he is the Conquering Stranger 
"
24278,Which statement best describes how Read changes throughout the story?,He overcame his cowardly ways to act for the good of his mission.,He became much less of an individual and more of a pawn for the UN.
61213,What is an accurate assumption about the Machine in the article?,"It ""thinks"" in a way that is more planned than a human.",The Machine is accurate yet slow compared to other computers.
25627,"According to Ron, what motivated him and Val to join the Geigs?",desire to maintain their present way of life,heroic reputational status upon returning to Earth
60507,What was *not* a result of the “Borenchuck Incident”?,Piltdon filed a lawsuit against Kalvin.,Super-Opener sales plummeted.
24192,Why was the cemetery joke a faux pas?,"Henry had died, but nobody was comfortable enough to talk about it.",The joke was so old that made everyone uncomfortable to hear again.
24161,What is the most precious commodity on the moon?,Water,Oxygen
20077,How does the author feel about the documentary?,It is poorly executed. ,The information is educational. 
61007,What is likely to happen to the crew when they return to the planet? ,"They'll fall victim like those before them, and have their supplies stolen. ","They'll return, still believing it's the Garden of Eden. "
61119,What is the likely cause of the proliferation of accidents in Granite City?,Something about the granite creates an inability to predict when an accident may occur.,The poor construction of the city's buildings and infrastructure.
20046,Who would the author most agree with about swearing?,Robert Graves,Ashley Montagu
99920,Which is true about managed systems?,The communication and innovation is lower because the workers have less flexibility,All of the actions in a process are performed by machines instead of humans
20043,Why does Seelye say she's hard on Dole?,because of the way his campaign is being run,because of the way he speaks
20015,What stance does the writer take in regards to Tina Brown. ,A neutral one. The anecdotes offered are too biased to make a judgement either way. ,Brown has built on William Shawn's legacy in her own way. 
51337,Why does Martin prefer to live on the yacht?,Martin is used to being isolated now. The people on land live in a different world than he does.,Martin thinks being on the ocean will make it harder for Conrad to find him.
27665,"Doris, Peter, and Hilary have all of the following characteristics in common EXCEPT for their:",Intelligence quotients,Controlled movements
51296,The characters experience many emotions for the first time during the events of this story.  What emotion(s) push the characters through the door.,Hatred and anger.,Excitement and curiosity.
62198,Why does Thig change his mind about the invasion?,"He remembers Ellen and the love he felt, and doesn't want to leave. ",He has forgotten why he lives for the Hord. 
62349,"What is Ahra referring to when she says ""something has been taken?""",The cansin male. ,Gertrude's happiness. 
31355,Which of these was not an impact of Russell's decision to kill Dunbar?,He was able to pick the path to the correct sun,Arguments increased amongst the team
20061,"What critique does film reviewer offer of Haynes? wishes he would let the picture catch its breath, that the performers would stop coming at me in stroboscopic flashes",His pacing is too frenetic and hasty,His costume and makeup design is too glamorous
50969,"Of the following options, which best describe Meredith?",Bold and pretty,Beautiful and brave
60713,Which of these is not true about Harrel Critten?,He is killed in order to protect the secret of the Red Mask,He was hired by the same people as the reporter was
51203,Why does Ben take offence to Cobb's comments about spacemen?,It's deeply personal to him. He grew up venerating space and space travel. He spent his whole life preparing for it. ,"He takes a lot of pride in his job, and dislikes Cobb disparaging it. "
51494,Why was the water important in this story?,It's where Purnie went to save his friends,It's where Purnie went searching for a device to help his friends
47841,"Of the three, who seems to keep holding secrets in more than the others?",Lorraine,Judy 
51361,What isn't a reason for narrator to be so skeptical of Gorb?,Gorb was asking for too much money,he had never heard of Wazzenazz
61052,Who were the horde members?,Hennessy’s crew and the children of the exploring party,Aliens pretending to be Hennessy’s crew and the children of the exploring party
61228,Why does Macklin have objections to going back?,"He doesn't want to go back. He'd rather be ""stupid"" than having headaches and always worrying. ",It's too risky to try the experiment again. He'd rather take his chances the way he is now. 
22876,Which word does NOT describe Lord Nehmon’s leadership?,Ineffective ,Passive
24977,What is Puerto Pacifico?,The city on a planet used as part of an attack plan by a group of aliens,A coastal American city where aliens work on a plan of attack
51688,Why was the main character daydreaming about being a war-time pilot?,He was actually there and the memories were real,He was obsessed with magazines about the subject
58733,Why is Alice so relaxed when she finds out there is no incubator aboard the space station?,Alice knows any room in the space station can be made into a giant incubator with minor adjustments.,"Alice is feeling delirious due to the pains of natural childbirth and is only concerned with getting the baby out, and getting the pain to stop at the moment."
61097,How does Retief convince the captain to keep him on board?,"The captain’s men as well as himself are too scared to confront him, so he leaves him be.","He doesn’t have time to deal with Retief, so he leaves him be."
51361,Which word least describes the narrator?,jealous,clever
63875,Why did Jaro ask to meet Miss Webb?,He wants to know what's really going on,He found her attractive
51286,Why couldn't most people tell Matilda where Haron lived?,he hadn't been in Cedar Falls for long,he was a very secretive person
52326,"What planet are the mysterious signals coming from? 

",Venus,Mars
63875,How did the Mercurians adjust to the heat?,They mostly lived under the ground.,Their yellow eyes filtered the sun’s rays.
25086,What is the most surprising detail about the Venusian delegate?,It must be assembled according to instructions,It self-destructs after a certain time period has passed
51202,Why did Davies attach himself to Infield outside of Infield & Morgan?,"He was afraid of heights and falling over, so he had affixed himself to Infield in order to calm his fear.","He had been aiming for George Price, whom he was trying to kill as punishment for knocking him to the ground earlier."
23960,How are the Gascons different from the rest of King Richard's cohort?,They are mercenaries,They are better trained
62198,Why did Torp feel it was necessary to test Thig's blood for disease after he returned?,Thig had become sentimental over the people of Earth.,Thig seemed to be sick after he returned.
24958,Why is it significant that the aliens only differ from humans in one physical characteristic?,The aliens happened to look like certain beings from stories of Earth's history.,It proves that the aliens and humans are actually distant relatives.
20046,What would Graves and Montagu agree about?,swearing makes people feel better,swearing is the adult form of whining
63899,At what moment in the story did the characters seem to have the least hope?,When they were mid-communication with the violent ships.,When they were about to crash into a comet.
31599,Why was Joey moving the stars?,To make a portrait of Charlie in his honor,To try and change space-time so that Charlie could be resurrected
24517,Why does Matt feel the need to warn people about the Chingsi?,Matt is convinced the Chingsi are bad luck.,Matt is convinced that Charlie deliberately destroyed the Whale.
51494,What is NOT true of Purnie?,Purnie meets his best friends,Purnie is thoughtful
20073,Why doesn't Falwell believe that the author could be the Antichrist?,The author is not a world leader,The author is not Jewish
51286,How didn't Matilda feel when Haron was talking?,enlightened,frustrated
61052,What is the future of the Pandora?,It will stay on the planet forever.,It will remain in space.
62498,Why was Pop upset about leaving life on Earth?,He felt selfish for making the family join along in his endeavors to a new planet.,The family was forced to leave Earth even though they did not want to leave.
51129,What was the real reason for the Earthmen to come to Zur?,they wanted to take over without war,they wanted to find ways to make more money
51609,"The Movement believes all of the following EXCEPT: Questioning the failings of the old society, failings have put them in the dome; failure of foreign policy (self-containment)","The best way to fight those controlling the Dome is collectively, versus individually",The 'old society's' failings led to the creation of the Dome
60995,Howell offers all of the following reasons why resurrection is problematic EXCEPT:,It is extremely costly,It is illegal
51203,"What is the irony in Ben's contempt for a single action destroying ""a man's life and his dream?""","He'd just done the same to a man by striking him without thought, and is now running from his guilt. ","He'd just deliberately ended a man's life, and his running from what he's done. "
62085,What was the author's purpose in describing the feeling the hypnotizing music evoked in such detail every time that it played?,To convey how powerful the music is.,To convey the dangerous intent of the music.
22876,Why is Ravdin willing to try and make peace with the Hunters?,It has been thousands of years since they have had contact,He believes he can convince their leader
63890,What would have happened had Major Polk never reported Captain Walsh for sleeping on Boiler Watch at the Academy?,Captain Walsh would have never sent Major Polk on the mission.,Major Polk and Captain Walsh would have never worked together like they do now.
63640,What was the stoolie's job?,To convince Casey to change his mind,To become Casey's friend and confidante
47841,Why did Judy start crying in the attic of her grandparents home?,She was lonely with no friends. ,She was sad that her parents wouldn't let her come on their vacation. 
51296,What caused the ship to leave its planet initially?,The reason is never disclosed.,The planet they were from ran out of viable resources.
25627,What likely happens to Val and Ron after the story ends? ,They stay on Mars for their contract and then move on to a different project,They stay on Mars for a few more weeks before heading back to Earth
63527,Why does Starre lay claim to the asteroid?,"She's trying to delay her arranged marriage, by preventing the asteroid from ever being delivered. ",She's trying to get away from her life. She can't stand how stubborn her Grandfather is. 
50969,How does Taphetta's initial response to Halden's evidence represent a greater dynamic between species?,"Like Taphetta, ribboneers are highly aware of their superior intellectual status, and are skeptical when presented with 'lower level' information","Like Taphetta, ribboneers are the quickest species to evolve, and are enthusiastic when presented with information that could further their advancement"
61263,"What is Hank’s relationship to Retief?
","Hank is a farmer from Lovenbroy requesting that Retief’s division, Libraries and Education, help him solve his labor problem. 
","He is a farmer from Lovenbroy requesting that Retief’s division, Commercial Markets, help him solve his labor problem. 
"
60515,What is the overall tone of the article?,Grim,Serious
31357,Which term best describes Tendal 13's perception of  Arvid 6's work ethic?,reckless,audacious
60515,"What happens to Europe after the bombs? 
","It becomes anarchic, with essentially no governments left. 
","It becomes anarchic, with nothing but gangs to officially end what is left of the war. 
"
61481,"To what is the title of the story, “Silence is—Deadly” referring? 
","Androka’s zone of silence is used as a deadly tool against the Comerford’s crew. 
","Androka’s zone of silence is used as a deadly tool, helping the Americans sneak up on a Nazi Islet. 
"
50988,What is the likeliest reason that Helen married Gabe?,he is good-looking and wealthy,he is good-looking and wealthy
63442,How was Antlers Park able to fool Ezra and Billy-boy into believing Grannie Annie was with him?,He was using one of the images from the birds as an impersonator of Grannie Annie ,His vehicle was equipped with technology that could infiltrate the invention by Baker
29196,Why does Lane want to go to Mars?,To have a chance to make his own decisions,"To follow Gerri Kin, for love"
52844,Did the questions Tremaine needed answers to get resolved?,No. He still doesn't know where the transmission is coming from.,"No. He thinks that Miss Carroll is behind this out of spite for Mr. Bram, but he's not quite sure."
24977,What is Puerto Pacifico?,Puerto Pacifico is a training ground for the androids that the aliens are sending to prepare Earth for invasion.,Puerto Pacifico is a training ground for the aliens who will be replacing key humans on Earth in preparation for invasion.
25086,"If the following event had not occurred, the Venusian delegate's identify would likely not have been discovered:",If Jerry had not kept his old notes from college physics,If the UN had not called a plenary session
61139,How does Retief first manage to arrange an interview/interrogation with Groacians officials?,"He gets into a bar fight, prompting an investigation and thus a visit from a Groacian government officials. Retief flips their interrogation when he begins to ask them the questions he needs answered. 

","He steals vital information from the Groacian archives and plans to use it for blackmail. Then he gets into a fight with a police officer, prompting Groacian officials to visit his office. He blackmails them for info when they arrive. "
50826,Which of the following is not a difference between Martians and Earthpeople?,Martians have tribal ceremonies,Martians can't carry a tune
20028,What isn't true of Sam Adams?,it was still considered one of the Bests,people scored it differently on the second test
23942,Why does Simon ultimately deny Mr. Oyster's request to go to Oktoberfest?,He knows he will not be allowed to do something that might impact the past,He thinks that Mr. Oyster is attempting to alter the space-time continuum
31357,Arvid 6 and Tendal 13 can perform all of the following abilities EXCEPT:,mind-reading,dematerialization
99901,Which does Stephen think is a useful impact of AIs in a broad context?,There can be regulation that can help people decide how to shape the future,They will boost the economy all over the world
26066,How does the Cosmic Express Ray work?,Matter is converted into power and sent out as a radiant beam. The beam is then focused to convert it back into atoms at the destination.,A radiant beam converts matter into power in order to be sent and then converted back into atoms at a new destination.
61139,What was Retief's ultimate mistake?,Trusting Miss Meuhl to do what he said,Breaking into the Foreign Ministry
26741,What is Paul doing in Tangier?,He is on a business trip to find a source of protein.,He is on a business trip scouting locations for thrill-seeking tourists.
